{
  "run_id": "20260508T212003.905573Z_benchmark_instruction_following_gemini_real_3067befa3a60",
  "parent_run_id": null,
  "model_name": "gemini_real",
  "model_version": "unknown",
  "prompt_version": "prompt_v1",
  "dataset_hash": "49c0f83a8e31be52ffd24307fecc1352d3b9d41a44a5be80d7dd5106e2f048ed",
  "evaluator_version": "rag_overlap_v1",
  "threshold_version": "release_gate_v1",
  "timestamp": "2026-05-09T02:40:16.540888+00:00"
}